17:05:25.719710 IP 192.168.17.6.58971 > 192.168.17.17.53: 27509+ A? suffix.oostum.north. (37)
17:05:25.720363 IP 192.168.17.17.53 > 192.168.17.6.58971: 27509 NXDomain* 0/1/0 (83)

17:05:25.721062 IP 192.168.17.6.55422 > 192.168.17.17.53: 39613+ A? suffix.rc.rug.nl. (34)
17:05:25.721804 IP 192.168.17.17.53 > 192.168.17.6.55422: 39613 1/3/2 A 129.125.3.162 (151)

17:05:25.722535 IP 192.168.17.6.34290 > 192.168.17.17.53: 45800+ AAAA? suffix.rc.rug.nl. (34)
17:05:25.723056 IP 192.168.17.17.53 > 192.168.17.6.34290: 45800 0/1/0 (88)

17:05:25.723608 IP 192.168.17.6.55550 > 192.168.17.17.53: 43333+ MX? suffix.rc.rug.nl. (34)
17:05:25.724110 IP 192.168.17.17.53 > 192.168.17.6.55550: 43333 0/1/0 (88)

17:05:39.723798 IP 192.168.17.6.39225 > 192.168.17.17.53: 1772+ A? oosix.oostum.north. (36)
17:05:39.724459 IP 192.168.17.17.53 > 192.168.17.6.39225: 1772 NXDomain* 0/1/0 (82)

17:05:39.725081 IP 192.168.17.6.34385 > 192.168.17.17.53: 63416+ A? oosix.rc.rug.nl. (33)

17:05:39.727519 IP 192.168.8.17.36257 > 129.125.4.1.53: 37500 [1au] A? oosix.rc.rug.nl. (56)
17:05:39.728752 IP 192.168.8.17.50311 > 129.125.4.1.53: 2654% [1au] A? dns2.rug.nl. (52)
17:05:39.728900 IP 192.168.8.17.43256 > 129.125.4.1.53: 15126% [1au] A? dns3.rug.nl. (52)
17:05:39.730142 IP 192.168.8.17.40803 > 129.125.4.1.53: 24390% [1au] AAAA? dns2.rug.nl. (52)
17:05:39.730433 IP 192.168.8.17.52463 > 129.125.4.1.53: 34721% [1au] AAAA? dns3.rug.nl. (52)
17:05:39.733001 IP 192.168.8.17.58901 > 192.33.4.12.53: 23527% [1au] A? dns3.rug.nl. (52)
17:05:39.733025 IP 192.168.8.17.41579 > 192.33.4.12.53: 3855% [1au] A? dns2.rug.nl. (52)
17:05:39.733991 IP 192.168.8.17.46011 > 192.33.4.12.53: 32057% [1au] AAAA? dns2.rug.nl. (52)
17:05:39.734014 IP 192.168.8.17.57781 > 192.33.4.12.53: 57227% [1au] AAAA? dns3.rug.nl. (52)
17:05:39.735164 IP 192.168.8.17.54966 > 192.33.4.12.53: 28160 [1au] NS? . (40)
17:05:39.735187 IP 192.168.8.17.40836 > 192.33.4.12.53: 11316% [1au] A? dns4.rug.nl. (52)
17:05:39.736026 IP 192.168.8.17.45253 > 192.33.4.12.53: 63419% [1au] AAAA? dns4.rug.nl. (52)

17:05:39.774247 IP 129.125.4.1.53 > 192.168.8.17.36257: 37500 NXDomain*- 0/1/1 (98)
17:05:39.775052 IP 192.168.17.17.53 > 192.168.17.6.34385: 63416 NXDomain 0/1/0 (87)

17:05:39.775947 IP 192.168.17.6.36055 > 192.168.17.17.53: 44038+ A? oosix.icce.rug.nl. (35)
17:05:39.777080 IP 192.168.8.17.33181 > 129.125.4.1.53: 33289 [1au] A? oosix.icce.rug.nl. (58)

17:05:39.781431 IP 129.125.4.1.53 > 192.168.8.17.50311: 2654*- 2/0/1 A 129.125.50.2, RRSIG (222)
17:05:39.782467 IP 129.125.4.1.53 > 192.168.8.17.43256: 15126*- 2/0/1 A 129.125.4.3, RRSIG (222)
17:05:39.782528 IP 129.125.4.1.53 > 192.168.8.17.40803: 24390*- 2/0/1 AAAA 2001:610:1a08:13:129:125:50:2, RRSIG (234)
17:05:39.782550 IP 129.125.4.1.53 > 192.168.8.17.52463: 34721*- 2/0/1 AAAA 2001:610:1a08:14:129:125:4:3, RRSIG (234)
17:05:39.786009 IP 192.33.4.12.53 > 192.168.8.17.58901: 23527-| 0/0/1 (40)
17:05:39.787322 IP 192.33.4.12.53 > 192.168.8.17.46011: 32057-| 0/0/1 (40)
17:05:39.787384 IP 192.33.4.12.53 > 192.168.8.17.57781: 57227-| 0/0/1 (40)
17:05:39.788515 IP 192.33.4.12.53 > 192.168.8.17.54966: 28160*-| 0/0/1 (28)
17:05:39.788577 IP 192.33.4.12.53 > 192.168.8.17.40836: 11316-| 0/0/1 (40)
17:05:39.789155 IP 192.33.4.12.53 > 192.168.8.17.41579: 3855-| 0/0/1 (40)
17:05:39.790068 IP 192.33.4.12.53 > 192.168.8.17.45253: 63419-| 0/0/1 (40)
17:05:39.805926 IP 129.125.4.1.53 > 192.168.8.17.33181: 33289*- 2/7/17 A 129.125.14.80, RRSIG (1472)
17:05:39.805955 IP 129.125.4.1 > 192.168.8.17: ip-proto-17

17:05:39.807870 IP 192.168.17.17.53 > 192.168.17.6.36055: 44038 1/6/8 A 129.125.14.80 (347)
17:05:39.808824 IP 192.168.17.6.33162 > 192.168.17.17.53: 62966+ AAAA? oosix.icce.rug.nl. (35)
17:05:39.811755 IP 192.168.8.17.56954 > 129.125.4.1.53: 8040 [1au] AAAA? oosix.icce.rug.nl. (58)
17:05:39.846466 IP 129.125.4.1.53 > 192.168.8.17.56954: 8040*- 0/4/1 (519)
17:05:39.847652 IP 192.168.17.17.53 > 192.168.17.6.33162: 62966 0/1/0 (89)
17:05:39.848483 IP 192.168.17.6.55028 > 192.168.17.17.53: 62612+ MX? oosix.icce.rug.nl. (35)
17:05:39.849952 IP 192.168.8.17.43542 > 129.125.50.2.53: 42959 [1au] MX? oosix.icce.rug.nl. (58)
17:05:39.864802 IP 192.168.8.17.40832 > 194.0.28.53.53: 6215% [1au] A? dns3.rug.nl. (52)
17:05:39.876520 IP 192.168.8.17.52299 > 194.0.28.53.53: 22203% [1au] AAAA? dns2.rug.nl. (52)
17:05:39.880283 IP 192.168.8.17.37822 > 194.0.28.53.53: 18961% [1au] AAAA? dns3.rug.nl. (52)
17:05:39.882285 IP 192.168.8.17.50701 > 194.0.28.53.53: 20898% [1au] A? dns4.rug.nl. (52)
17:05:39.883309 IP 129.125.50.2.53 > 192.168.8.17.43542: 42959*-| 0/0/1 (46)
17:05:39.884191 IP 192.168.8.17.36895 > 194.0.28.53.53: 50061% [1au] A? dns2.rug.nl. (52)
17:05:39.884214 IP 192.168.8.17.47207 > 194.0.28.53.53: 57192% [1au] AAAA? dns4.rug.nl. (52)
17:05:39.897209 IP 194.0.28.53.53 > 192.168.8.17.40832: 6215- 0/9/13 (677)
17:05:39.901402 IP 192.168.8.17.60446 > 129.125.4.3.53: 29979% [1au] A? dns3.rug.nl. (52)
17:05:39.914449 IP 194.0.28.53.53 > 192.168.8.17.52299: 22203- 0/9/13 (677)
17:05:39.916367 IP 192.168.8.17.52503 > 46.182.222.81.53: 12315% [1au] AAAA? dns2.rug.nl. (52)
17:05:39.924453 IP 194.0.28.53.53 > 192.168.8.17.50701: 20898- 0/9/13 (677)
17:05:39.926236 IP 194.0.28.53.53 > 192.168.8.17.37822: 18961- 0/9/13 (677)
17:05:39.926814 IP 192.168.8.17.47659 > 46.182.222.81.53: 8169% [1au] A? dns4.rug.nl. (52)
17:05:39.927434 IP 194.0.28.53.53 > 192.168.8.17.36895: 50061- 0/9/13 (677)
17:05:39.927531 IP 194.0.28.53.53 > 192.168.8.17.47207: 57192- 0/9/13 (677)
17:05:39.928165 IP 192.168.8.17.42478 > 46.182.222.81.53: 47246% [1au] AAAA? dns3.rug.nl. (52)
17:05:39.929992 IP 192.168.8.17.36008 > 46.182.222.81.53: 18774% [1au] A? dns2.rug.nl. (52)
17:05:39.930016 IP 192.168.8.17.36039 > 46.182.222.81.53: 6634% [1au] AAAA? dns4.rug.nl. (52)
17:05:39.937415 IP 129.125.4.3.53 > 192.168.8.17.60446: 29979*- 2/0/1 A 129.125.4.3, RRSIG (222)
17:05:39.949237 IP 46.182.222.81.53 > 192.168.8.17.52503: 12315*- 2/0/1 AAAA 2001:610:1a08:13:129:125:50:2, RRSIG (234)
17:05:39.961388 IP 46.182.222.81.53 > 192.168.8.17.47659: 8169*- 2/0/1 A 46.182.222.81, RRSIG (222)
17:05:39.963758 IP 192.168.17.17.53 > 192.168.17.6.55028: 62612 0/1/0 (89)
17:05:39.972438 IP 46.182.222.81.53 > 192.168.8.17.36008: 18774*- 2/0/1 A 129.125.50.2, RRSIG (222)
17:05:39.975192 IP 46.182.222.81.53 > 192.168.8.17.42478: 47246*- 2/0/1 AAAA 2001:610:1a08:14:129:125:4:3, RRSIG (234)
17:05:39.978302 IP 46.182.222.81.53 > 192.168.8.17.36039: 6634*- 2/0/1 AAAA 2a00:1bd0:879:1::81, RRSIG (234)
17:05:51.991389 IP 192.168.17.22.64899 > 192.168.17.17.53: 10483+ A? play.google.com. (33)
17:05:51.991512 IP 192.168.17.22.64900 > 5.45.62.38.53: 14160 updateDA+% [b2&3=0x5971] [31348a] [30566q] [35022n] [48905au] Type7474 (Class 32657)? <BAD PTR>[|domain]
17:05:51.991581 IP 192.168.8.17.64900 > 5.45.62.38.53: 14160 updateDA+% [b2&3=0x5971] [31348a] [30566q] [35022n] [48905au] Type7474 (Class 32657)? <BAD PTR>[|domain]
17:05:51.992513 IP 192.168.17.17.53 > 192.168.17.22.64899: 10483 2/4/0 CNAME play.l.google.com., A 172.217.20.78 (142)
17:05:52.010640 IP 192.168.17.22.64899 > 192.168.17.17.53: 10483+ A? play.google.com. (33)
17:05:52.011583 IP 192.168.17.17.53 > 192.168.17.22.64899: 10483 2/4/0 CNAME play.l.google.com., A 172.217.20.78 (142)
17:05:52.062517 IP 5.45.62.38.53 > 192.168.8.17.64900: 29238 updateM [b2&3=0x666e] [27192a] [30295q] [61216n] [51661au] Type23187 (Class 46633)? M-RM-^G^Uk^H^D"^UM-^GM-V^F9M-pM-uM/^?M-ODM-=M-^@M-b<M-^GFM-uM-/M-l($M-^WM-(^WMM-^EM-^LLggM-pM-3M-uM-'t^D^TM-^A3/M-{^QM-[M-^JM-^H^KF+2M-nM-HM-@M-rM-R1VM-%M-QM-^O^SM-&M-H^\M-B^GzP!M-=]M-mM-vM-)M-lq^FM-M^LOM-^LM-&M-^]^H!K^UM-}YM-bM-X^L^V^FM-xM-4M-qI>M-^ZM-kM-EM-^WM-9^U^MikM-+5M-^VfM-[M-\rM-vM-yKM-th,M-NNM-mM-#M-^R^G4M-'^[M-ylM-oyN2^[M-lM-idM-^RM-=M-%M-)M-`M-%M-;M-JQ/^EM- M- -v^C+^U?a?`M-^O.<BAD PTR>[|domain]
17:05:52.062561 IP 5.45.62.38.53 > 192.168.17.22.64900: 29238 updateM [b2&3=0x666e] [27192a] [30295q] [61216n] [51661au] Type23187 (Class 46633)? M-RM-^G^Uk^H^D"^UM-^GM-V^F9M-pM-uM/^?M-ODM-=M-^@M-b<M-^GFM-uM-/M-l($M-^WM-(^WMM-^EM-^LLggM-pM-3M-uM-'t^D^TM-^A3/M-{^QM-[M-^JM-^H^KF+2M-nM-HM-@M-rM-R1VM-%M-QM-^O^SM-&M-H^\M-B^GzP!M-=]M-mM-vM-)M-lq^FM-M^LOM-^LM-&M-^]^H!K^UM-}YM-bM-X^L^V^FM-xM-4M-qI>M-^ZM-kM-EM-^WM-9^U^MikM-+5M-^VfM-[M-\rM-vM-yKM-th,M-NNM-mM-#M-^R^G4M-'^[M-ylM-oyN2^[M-lM-idM-^RM-=M-%M-)M-`M-%M-;M-JQ/^EM- M- -v^C+^U?a?`M-^O.<BAD PTR>[|domain]
17:05:52.066176 IP 192.168.17.22.51579 > 192.168.17.17.53: 4351+ A? play.l.google.com. (35)
17:05:52.066409 IP 192.168.17.22.51580 > 5.45.62.38.53: 14160 updateDA+% [b2&3=0x5971] [31348a] [30566q] [35022n] [48905au] Type7474 (Class 32657)? <BAD PTR>[|domain]
17:05:52.066499 IP 192.168.8.17.51580 > 5.45.62.38.53: 14160 updateDA+% [b2&3=0x5971] [31348a] [30566q] [35022n] [48905au] Type7474 (Class 32657)? <BAD PTR>[|domain]
17:05:52.067047 IP 192.168.17.17.53 > 192.168.17.22.51579: 4351 1/4/0 A 172.217.20.78 (123)
17:05:52.088585 IP 192.168.17.22.51579 > 192.168.17.17.53: 4351+ A? play.l.google.com. (35)
17:05:52.089386 IP 192.168.17.17.53 > 192.168.17.22.51579: 4351 1/4/0 A 172.217.20.78 (123)
17:05:52.125455 IP 5.45.62.38.53 > 192.168.8.17.51580: 29238 updateM [b2&3=0x666e] [27192a] [30295q] [17923n] [24018au] Type52758 (Class 22208)? M-RM-^G^U^@M-^I-q^UM-^GM-V^F=8M5M-/S@M-uM-Ig^QM-Q}^_iZM-;M-*TJM-MWDM-\M-.M-6mYM-\tM-^XsM-YM-^BM-&M-0M-,^ZM-<bM-BM-N^?^SM-d>M-|M-'M-kM-OM-*<^KOM-a^@M-YM-^,^[M-g^D^_ah^_^K{M->M-,EzM-^OM-aM-bBM-^ZM-^RQ6M-5M-R!8M-^@^B^DM-(M-FRM-QiM-SgM-CM-JM-fWM-^ZM-^J<^HM-,M-sM-DCdM-^WM-^BM-wM-XM-FM-pM-dM-#^LM-wM-8M-L:0M-^E-M-^[EM-DFDO^MM-LM-UM-^JM-^WM-(M-,M-NHN2M-O&^VM-^IM-_=^BM- M-i;M-(HM-NM-P!M-)^B(M-^X'.<BAD PTR>[|domain]
17:05:52.125551 IP 5.45.62.38.53 > 192.168.17.22.51580: 29238 updateM [b2&3=0x666e] [27192a] [30295q] [17923n] [24018au] Type52758 (Class 22208)? M-RM-^G^U^@M-^I-q^UM-^GM-V^F=8M5M-/S@M-uM-Ig^QM-Q}^_iZM-;M-*TJM-MWDM-\M-.M-6mYM-\tM-^XsM-YM-^BM-&M-0M-,^ZM-<bM-BM-N^?^SM-d>M-|M-'M-kM-OM-*<^KOM-a^@M-YM-^,^[M-g^D^_ah^_^K{M->M-,EzM-^OM-aM-bBM-^ZM-^RQ6M-5M-R!8M-^@^B^DM-(M-FRM-QiM-SgM-CM-JM-fWM-^ZM-^J<^HM-,M-sM-DCdM-^WM-^BM-wM-XM-FM-pM-dM-#^LM-wM-8M-L:0M-^E-M-^[EM-DFDO^MM-LM-UM-^JM-^WM-(M-,M-NHN2M-O&^VM-^IM-_=^BM- M-i;M-(HM-NM-P!M-)^B(M-^X'.<BAD PTR>[|domain]
17:05:52.127429 IP 192.168.17.22.56563 > 192.168.17.17.53: 54251+ AAAA? play.l.google.com. (35)
17:05:52.127532 IP 192.168.17.22.56564 > 5.45.62.38.53: 14160 updateDA+% [b2&3=0x5971] [31348a] [30566q] [35022n] [48905au] Type7474 (Class 32657)? <BAD PTR>[|domain]
17:05:52.127592 IP 192.168.8.17.56564 > 5.45.62.38.53: 14160 updateDA+% [b2&3=0x5971] [31348a] [30566q] [35022n] [48905au] Type7474 (Class 32657)? <BAD PTR>[|domain]
17:05:52.128338 IP 192.168.17.17.53 > 192.168.17.22.56563: 54251 1/4/0 AAAA 2a00:1450:400e:80a::200e (135)
17:05:52.151251 IP 192.168.17.22.56563 > 192.168.17.17.53: 54251+ AAAA? play.l.google.com. (35)
17:05:52.151752 IP 192.168.17.17.53 > 192.168.17.22.56563: 54251 1/4/0 AAAA 2a00:1450:400e:80a::200e (135)
17:05:52.183448 IP 5.45.62.38.53 > 192.168.8.17.56564: 29238 updateM [b2&3=0x666e] [27192a] [30295q] [7969n] [5846au][|domain]
17:05:52.183514 IP 5.45.62.38.53 > 192.168.17.22.56564: 29238 updateM [b2&3=0x666e] [27192a] [30295q] [7969n] [5846au][|domain]
17:06:27.709263 IP 192.168.17.11.62360 > 192.168.17.17.53: 60570+ A? mobile.pipe.aria.microsoft.com. (48)
17:06:27.711838 IP 192.168.8.17.41256 > 184.26.160.131.53: 18337 [1au] A? prd.col.aria.mobile.skypedata.akadns.net. (81)
17:06:27.758589 IP 184.26.160.131.53 > 192.168.8.17.41256: 18337*- 1/0/1 CNAME pipe.skype.com. (97)
17:06:27.761386 IP 192.168.8.17.56890 > 184.26.160.131.53: 45556 [1au] A? pipe.prd.skypedata.akadns.net. (70)
17:06:27.795429 IP 184.26.160.131.53 > 192.168.8.17.56890: 45556*- 1/0/1 CNAME pipe.cloudapp.aria.akadns.net. (91)
17:06:27.798147 IP 192.168.8.17.44437 > 184.26.160.131.53: 42769 [1au] A? pipe.cloudapp.aria.akadns.net. (70)
17:06:27.835289 IP 184.26.160.131.53 > 192.168.8.17.44437: 42769*- 1/0/1 A 40.115.1.44 (74)
17:06:27.836819 IP 192.168.17.17.53 > 192.168.17.11.62360: 60570 5/10/5 CNAME prd.col.aria.mobile.skypedata.akadns.net., CNAME pipe.skype.com., CNAME pipe.prd.skypedata.akadns.net., CNAME pipe.cloudapp.aria.akadns.net., A 40.115.1.44 (504)

17:06:43.415431 IP 192.168.17.6.34441 > 192.168.17.17.53: 692+ A? whois.arin.net. (32)
17:06:43.417367 IP 192.168.8.17.50053 > 199.5.26.108.53: 58748 [1au] A? whois.arin.net. (55)
17:06:43.601713 IP 199.5.26.108.53 > 192.168.8.17.50053: 58748*- 4/5/17 A 199.212.0.46, A 199.71.0.46, A 199.5.26.46, RRSIG (1472)
17:06:43.601748 IP 199.5.26.108 > 192.168.8.17: ip-proto-17
17:06:43.604145 IP 192.168.17.17.53 > 192.168.17.6.34441: 692 3/4/1 A 199.71.0.46, A 199.212.0.46, A 199.5.26.46 (178)
17:06:43.982548 IP 192.168.17.6.38807 > 192.168.17.17.53: 12454+ A? whois.ripe.net. (32)
17:06:43.984461 IP 192.168.8.17.40717 > 193.0.9.7.53: 901 [1au] A? whois.ripe.net. (71)
17:06:44.023341 IP 193.0.9.7.53 > 192.168.8.17.40717: 901*- 2/0/1 A 193.0.6.135, RRSIG (255)
17:06:44.025196 IP 192.168.17.17.53 > 192.168.17.6.38807: 12454 1/7/8 A 193.0.6.135 (397)
17:06:50.154824 IP 192.168.17.22.62032 > 192.168.17.17.53: 35372+ A? store.office.com. (34)
17:06:50.154954 IP 192.168.17.22.62033 > 5.45.62.38.53: 14160 updateDA+% [b2&3=0x5971] [31348a] [30566q] [35022n] [48905au] Type7474 (Class 32657)? <BAD PTR>[|domain]
17:06:50.155022 IP 192.168.8.17.62033 > 5.45.62.38.53: 14160 updateDA+% [b2&3=0x5971] [31348a] [30566q] [35022n] [48905au] Type7474 (Class 32657)? <BAD PTR>[|domain]
17:06:50.157286 IP 192.168.8.17.35325 > 157.55.133.11.53: 1364 [1au] A? store.office.com. (57)
17:06:50.185496 IP 192.168.17.22.62032 > 192.168.17.17.53: 35372+ A? store.office.com. (34)
17:06:50.240489 IP 5.45.62.38.53 > 192.168.8.17.62033: 29238 updateM [b2&3=0x666e] [27192a] [30295q] [44032n] [50859au][|domain]
17:06:50.240583 IP 5.45.62.38.53 > 192.168.17.22.62033: 29238 updateM [b2&3=0x666e] [27192a] [30295q] [44032n] [50859au][|domain]
17:06:50.289480 IP 157.55.133.11.53 > 192.168.8.17.35325: 1364*- 1/0/1 CNAME retailer.osi.office.net. (82)
17:06:50.291683 IP 192.168.8.17.45959 > 208.84.0.53.53: 58197 [1au] A? retailer.osi.office.net. (64)
17:06:50.329414 IP 208.84.0.53.53 > 192.168.8.17.45959: 58197*- 1/0/1 CNAME prod.omexretailer.live.com.akadns.net. (112)
17:06:50.332536 IP 192.168.8.17.48321 > 184.26.160.131.53: 17245 [1au] A? prod.omexretailer.live.com.akadns.net. (78)
17:06:50.364259 IP 184.26.160.131.53 > 192.168.8.17.48321: 17245*- 1/0/1 CNAME weu-000.retailer.osi.office.net. (108)
17:06:50.365911 IP 192.168.8.17.60644 > 193.221.113.53.53: 46755 [1au] A? weu-000.retailer.osi.office.net. (72)
17:06:50.393391 IP 193.221.113.53.53 > 192.168.8.17.60644: 46755*- 1/0/1 CNAME osiprod-weu-ginger-000.cloudapp.net. (118)
17:06:50.399590 IP 192.168.8.17.37017 > 204.79.195.48.53: 44547 [1au] A? osiprod-weu-ginger-000.cloudapp.net. (76)
17:06:50.435258 IP 204.79.195.48.53 > 192.168.8.17.37017: 44547*- 1/0/1 A 52.166.206.199 (80)
17:06:50.436596 IP 192.168.17.17.53 > 192.168.17.22.62032: 35372 5/4/0 CNAME retailer.osi.office.net., CNAME prod.omexretailer.live.com.akadns.net., CNAME weu-000.retailer.osi.office.net., CNAME osiprod-weu-ginger-000.cloudapp.net., A 52.166.206.199 (294)
17:06:51.623750 IP 192.168.17.22.53584 > 192.168.17.17.53: 47762+ A? wikipedia.firstpartyapps.oaspapps.com. (55)
17:06:51.623996 IP 192.168.17.22.53585 > 5.45.62.38.53: 14160 updateDA+% [b2&3=0x5971] [31348a] [30566q] [35022n] [48905au] Type7474 (Class 32657)? <BAD PTR>[|domain]
17:06:51.624076 IP 192.168.8.17.53585 > 5.45.62.38.53: 14160 updateDA+% [b2&3=0x5971] [31348a] [30566q] [35022n] [48905au] Type7474 (Class 32657)? <BAD PTR>[|domain]
17:06:51.629443 IP 192.168.8.17.51912 > 192.41.162.30.53: 56788 [1au] A? wikipedia.firstpartyapps.oaspapps.com. (78)
17:06:51.654590 IP 192.168.17.22.53584 > 192.168.17.17.53: 47762+ A? wikipedia.firstpartyapps.oaspapps.com. (55)
17:06:51.662425 IP 192.41.162.30.53 > 192.168.8.17.51912: 56788- 0/8/9 (807)
17:06:51.664440 IP 192.168.8.17.57720 > 193.221.113.53.53: 56248 [1au] A? wikipedia.firstpartyapps.oaspapps.com. (78)
17:06:51.693390 IP 193.221.113.53.53 > 192.168.8.17.57720: 56248*- 2/0/1 CNAME firstpartyapps.oaspapps.com., CNAME prod.firstpartyapps.oaspapps.com.akadns.net. (149)
17:06:51.695605 IP 192.168.8.17.40827 > 208.84.0.53.53: 1660 [1au] A? firstpartyapps.oaspapps.com. (68)
17:06:51.723289 IP 5.45.62.38.53 > 192.168.8.17.53585: 29238 updateM [b2&3=0x666e] [27192a] [30295q] [21026n] [28421au][|domain]
17:06:51.723359 IP 5.45.62.38.53 > 192.168.17.22.53585: 29238 updateM [b2&3=0x666e] [27192a] [30295q] [21026n] [28421au][|domain]
17:06:51.725203 IP 208.84.0.53.53 > 192.168.8.17.40827: 1660*- 1/0/1 CNAME prod.firstpartyapps.oaspapps.com.akadns.net. (125)
17:06:51.728292 IP 192.168.8.17.34137 > 184.26.160.131.53: 38367 [1au] A? prod.firstpartyapps.oaspapps.com.akadns.net. (84)
17:06:51.774293 IP 184.26.160.131.53 > 192.168.8.17.34137: 38367*- 1/0/1 CNAME neu-zzz.firstpartyapps.oaspapps.com. (121)
17:06:51.776050 IP 192.168.8.17.38861 > 208.76.45.53.53: 42710 [1au] A? neu-zzz.firstpartyapps.oaspapps.com. (76)
17:06:51.805312 IP 208.76.45.53.53 > 192.168.8.17.38861: 42710*- 1/0/1 CNAME osi-prod-neu01-firstpartapps.cloudapp.net. (131)
17:06:51.808762 IP 192.168.8.17.49381 > 65.55.117.43.53: 50575 [1au] A? osi-prod-neu01-firstpartapps.cloudapp.net. (82)
17:06:51.872339 IP 65.55.117.43.53 > 192.168.8.17.49381: 50575*- 1/0/1 A 168.63.38.208 (86)
17:06:51.873902 IP 192.168.17.17.53 > 192.168.17.22.53584: 47762 5/4/0 CNAME firstpartyapps.oaspapps.com., CNAME prod.firstpartyapps.oaspapps.com.akadns.net., CNAME neu-zzz.firstpartyapps.oaspapps.com., CNAME osi-prod-neu01-firstpartapps.cloudapp.net., A 168.63.38.208 (307)
17:07:04.610544 IP 192.168.17.22.49365 > 192.168.17.17.53: 50440+ A? sf.umcg.nl. (28)
17:07:04.610801 IP 192.168.17.22.49366 > 5.45.62.38.53: 14160 updateDA+% [b2&3=0x5971] [31348a] [30566q] [35022n] [48905au] Type7474 (Class 32657)? <BAD PTR>[|domain]
17:07:04.610902 IP 192.168.8.17.49366 > 5.45.62.38.53: 14160 updateDA+% [b2&3=0x5971] [31348a] [30566q] [35022n] [48905au] Type7474 (Class 32657)? <BAD PTR>[|domain]
17:07:04.612919 IP 192.168.8.17.55949 > 194.0.28.53.53: 52744 [1au] A? sf.umcg.nl. (51)
17:07:04.639599 IP 192.168.17.22.49365 > 192.168.17.17.53: 50440+ A? sf.umcg.nl. (28)
17:07:04.665490 IP 194.0.28.53.53 > 192.168.8.17.55949: 52744- 0/7/6 (704)
17:07:04.667942 IP 192.168.8.17.55713 > 192.87.23.112.53: 37542 [1au] A? sf.umcg.nl. (51)
17:07:04.682416 IP 5.45.62.38.53 > 192.168.8.17.49366: 29238 updateM [b2&3=0x666e] [27192a] [30295q] [43777n] [6430au] Type43488 (Class 14487)? M-RM-^G^UM-KM->/9^UM-^GM-V^WM-^J^[M-|zM-Q"@M-c M-EM-@M-^UKM-^ZMM-g3iVM-FSM-OIM-J^OM-HM-YM-X^ZM-+7M-?yM-*M-`8M-^_M-[M_^CM-pFM-cM-O^A2M-^^AFM-.1^UcvxRM-T4BM-^^M-SM-&HM-^UsM-UM--hM-^?zM-EM-^HM-z^_M-gfM-^Q/(M-^V^EM-5M-`M-N8^_M->M-^TM-'M-%M-;)M-UuM-,M-}M-cM-XM-J^H/M-YM-uM- *pM-BM-R/M-^^G"M-!GM-U^^stM->M-MbM-W^VKnr^@g7M-{M-^R$M-3M-2 QM-c7|C~M-5M-V[M-z|M-qM-DM-^U9M-3M-7kM-@^C:M-%M-ZYM-^TM-^DuUBD#M-=M-%M-}M-j<9^KM-fM-^GM-w].<BAD PTR>[|domain]
17:07:04.682490 IP 5.45.62.38.53 > 192.168.17.22.49366: 29238 updateM [b2&3=0x666e] [27192a] [30295q] [43777n] [6430au] Type43488 (Class 14487)? M-RM-^G^UM-KM->/9^UM-^GM-V^WM-^J^[M-|zM-Q"@M-c M-EM-@M-^UKM-^ZMM-g3iVM-FSM-OIM-J^OM-HM-YM-X^ZM-+7M-?yM-*M-`8M-^_M-[M_^CM-pFM-cM-O^A2M-^^AFM-.1^UcvxRM-T4BM-^^M-SM-&HM-^UsM-UM--hM-^?zM-EM-^HM-z^_M-gfM-^Q/(M-^V^EM-5M-`M-N8^_M->M-^TM-'M-%M-;)M-UuM-,M-}M-cM-XM-J^H/M-YM-uM- *pM-BM-R/M-^^G"M-!GM-U^^stM->M-MbM-W^VKnr^@g7M-{M-^R$M-3M-2 QM-c7|C~M-5M-V[M-z|M-qM-DM-^U9M-3M-7kM-@^C:M-%M-ZYM-^TM-^DuUBD#M-=M-%M-}M-j<9^KM-fM-^GM-w].<BAD PTR>[|domain]
17:07:04.708310 IP 192.87.23.112.53 > 192.168.8.17.55713: 37542 FormErr- 0/0/1 (51)
17:07:04.709505 IP 192.168.8.17.57746 > 192.87.23.112.53: 49465 A? sf.umcg.nl. (28)
17:07:04.748236 IP 192.87.23.112.53 > 192.168.8.17.57746: 49465*- 0/1/0 (80)
17:07:04.749402 IP 192.168.17.17.53 > 192.168.17.22.49365: 50440 0/1/0 (80)
17:07:04.758959 IP 192.168.17.22.64420 > 192.168.17.17.53: 58365+ A? as.umcg.nl. (28)
17:07:04.759075 IP 192.168.17.22.57377 > 192.168.17.17.53: 4245+ A? www.citrix.com. (32)
17:07:04.759157 IP 192.168.17.22.57378 > 5.45.62.38.53: 14160 updateDA+% [b2&3=0x5971] [31348a] [30566q] [35022n] [48905au] Type7474 (Class 32657)? <BAD PTR>[|domain]
17:07:04.759243 IP 192.168.8.17.57378 > 5.45.62.38.53: 14160 updateDA+% [b2&3=0x5971] [31348a] [30566q] [35022n] [48905au] Type7474 (Class 32657)? <BAD PTR>[|domain]
17:07:04.759351 IP 192.168.17.22.57379 > 5.45.62.38.53: 14160 updateDA+% [b2&3=0x
