21:44:16.999488 IP 192.168.8.17.36655 > 129.125.3.162.7750: UDP, length 9  e
21:44:43.136940 IP 192.168.8.17.55412 > 129.125.3.162.7750: UDP, length 6  e
21:44:54.219516 IP 192.168.8.17.52516 > 129.125.3.162.7750: UDP, length 6  e
21:45:00.042060 IP 192.168.8.17.52516 > 129.125.3.162.7750: UDP, length 9  e
21:45:16.277585 IP 192.168.8.17.52516 > 129.125.3.162.7750: UDP, length 11 e
21:49:40.710115 IP 192.168.8.17.52516 > 129.125.3.162.7750: UDP, length 3  e
21:54:20.949865 IP 192.168.8.17.46426 > 129.125.3.162.7750: UDP, length 3  e
21:54:20.997645 IP 129.125.3.162.7750 > 192.168.8.17.46426: UDP, length 3  e
21:54:55.723551 IP 192.168.8.17.46426 > 129.125.3.162.7750: UDP, length 3  e
21:55:05.146422 IP 129.125.3.162.7750 > 192.168.8.17.46426: UDP, length 7  e
21:55:16.424542 IP 192.168.8.17.46426 > 129.125.3.162.7750: UDP, length 6  e
21:55:24.857534 IP 129.125.3.162.7750 > 192.168.8.17.46426: UDP, length 7  e 

21:44:16.999414 IP 192.168.17.6.36655 > 129.125.3.162.7750: UDP, length 9  b
21:44:43.136860 IP 192.168.17.6.55412 > 129.125.3.162.7750: UDP, length 6  b
21:44:54.219395 IP 192.168.17.6.52516 > 129.125.3.162.7750: UDP, length 6  b
21:45:00.042005 IP 192.168.17.6.52516 > 129.125.3.162.7750: UDP, length 9  b
21:45:16.277518 IP 192.168.17.6.52516 > 129.125.3.162.7750: UDP, length 11 b
21:49:40.710018 IP 192.168.17.6.52516 > 129.125.3.162.7750: UDP, length 3  b
21:54:20.949776 IP 192.168.17.6.46426 > 129.125.3.162.7750: UDP, length 3  b
21:54:20.997684 IP 129.125.3.162.7750 > 192.168.17.6.46426: UDP, length 3  b
21:54:55.723449 IP 192.168.17.6.46426 > 129.125.3.162.7750: UDP, length 3  b
21:55:05.146466 IP 129.125.3.162.7750 > 192.168.17.6.46426: UDP, length 7  b
21:55:16.424469 IP 192.168.17.6.46426 > 129.125.3.162.7750: UDP, length 6  b
21:55:24.857576 IP 129.125.3.162.7750 > 192.168.17.6.46426: UDP, length 7  b
21:55:31.824222 IP 192.168.17.6.46426 > 129.125.3.162.7750: UDP, length 3  b
21:55:36.279517 IP 129.125.3.162.7750 > 192.168.17.6.46426: UDP, length 7  b

