SYN van 129.125.3.162 naar 129.125.100.246: 
                                            12:00:52.783685 IP 129.125.3.162.56301 > 129.125.100.246.222: Flags [S], 
SYN SRC NAT naar 10.4.0.6:
                                            12:00:52.783715 IP 129.125.3.162.56301 > 10.4.0.6.22: Flags [S], 
                                                               =================== Identical, maar dat hoeft niet: IP FW regel stelt: source nat 222 naar 10.4.0.6:22:
                                                                                   iptables -t nat -A PREROUTING -s $suffix -d $vpn --dport 222 -j DNAT --to-destination $styxIP:22
                                                                                   Dus: 129.125.3.162.56301 -> 129.125.100.246.222 => 129.125.3.162.56301 -> 10.4.0.6.22

SYN,ACK van 10.4.0.6:22 naar 129.125.3.162
                                            12:00:52.790015 IP 10.4.0.6.22 > 129.125.3.162.56301: Flags [S.], 
                                            12:00:52.790038 IP 129.125.100.246.222 > 129.125.3.162.56301: Flags [S.], 


12:00:58.731042 IP 129.125.3.162.56301 > 129.125.100.246.222: Flags [F.], 
12:00:58.731052 IP 129.125.3.162.56301 > 10.4.0.6.22: Flags [F.], 
12:00:58.744042 IP 10.4.0.6.22 > 129.125.3.162.56301: Flags [F.], 
12:00:58.744056 IP 129.125.100.246.222 > 129.125.3.162.56301: Flags [F.], 
